{
  "packet_id": "S09",
  "recommendation": "needs_info",
  "summary": "We cannot decide on this referral yet. What was sent suggests she may qualify, but most of the required documents are missing. Please send the items below and tell us who will change the wound packing on 09/16.",
  "findings": [
    {
      "rule": "GEN-1",
      "status": "met",
      "evidence": [
        {
          "page": 6,
          "quote": "Patient is unhoused and sleeps in a park."
        }
      ]
    },
    {
      "rule": "INT-E1",
      "status": "met",
      "evidence": [
        {
          "page": 4,
          "quote": "Changed to oral trimethoprim-sulfamethoxazole yesterday evening."
        }
      ]
    },
    {
      "rule": "INF-1",
      "status": "unknown",
      "note": "No MRSA swab result anywhere in the packet.",
      "evidence": []
    },
    {
      "rule": "INF-2",
      "status": "unknown",
      "note": "No COVID swab result anywhere in the packet.",
      "evidence": []
    },
    {
      "rule": "ID-1",
      "status": "unknown",
      "note": "Five sets of vitals are required; two were sent.",
      "evidence": [
        {
          "page": 5,
          "quote": "Two sets shown. Complete flowsheet available from the unit."
        }
      ]
    },
    {
      "rule": "MOB-2",
      "status": "unknown",
      "note": "No PT/OT or nursing notes were sent.",
      "evidence": []
    },
    {
      "rule": "INT-E2",
      "status": "unknown",
      "note": "A dressing change is due within 48 hours and nobody is lined up to do it.",
      "evidence": [
        {
          "page": 6,
          "quote": "Packing change due 09/16/2026. Location not yet arranged."
        }
      ]
    }
  ],
  "missing_documents": [
    "DOC-1",
    "DOC-3",
    "DOC-7",
    "DOC-8",
    "DOC-9",
    "DOC-10"
  ],
  "follow_up_questions": [
    "Please send the completed referral form.",
    "Please send the last five sets of vital signs.",
    "Please send the MRSA and COVID swab results.",
    "Please send the medication list, and confirm she will arrive with a 30-day supply.",
    "Please send PT/OT or nursing notes.",
    "Please send the wound culture result when it is final.",
    "Who will change the packing on 09/16, and is that scheduled?",
    "Has the health plan authorization been submitted?"
  ],
  "contradictions": []
}
